index,Title,JobDescription,JobRequirment
448,Health Coordinator,"Health Coordinator will be responsible for direct coordination, supervision and technical monitoring of the Mobile Medical Teams (MMT) and Primary Health care project success and constrains.","The position is starting in August 2004 and is based in World Vision Armenia' National office, Yerevan with extensive countrywide travel.  -	Coordination and obtaining of MMT related guides and protocols. -	Development, pre-testing and applying of new training materials, strategies and plans for increasing and promoting overall program effectiveness and efficiency. -	Supporting the MMT Manager in  the implementation of program activities in assigned sites.  -	Providing technical monitoring for respective MMT activities and developing technical reports. -	Liaising between MMT field staff, local partners field staff, target beneficiaries and WV Armenia National Office staff involved in the program implementation, management and oversight.  -	Coordination and facilitation of data collection, analysis and management. -	Fostering working relationship with local and national health authorities, NGOs, medical community, stakeholders and other counterparts related to the field of Primary Health Care."
449,Global Fund ATM Implementation Unit Officer,"To work collaboratively with the Program implementing partners, providing support and coordination to the program operations monitoring and evaluation.","- Participate in preparation of TORs, RFAs and other documents throughout the project duration. - In collaboration with Team Leader develop program plans in accordance with the program objectives and activities. Develop detailed Work Plan for all periods of implementation. - Participate in preparatory activities relating to selection of program partners and sub-recipients. Advise sub-recipients on capacity building and relevant activities requirement.  - Collaborate with stakeholders during an overall program level data collection and analysis; plan and analyze indicators at different levels of M&E. - Develop and sustain the appropriate protocols and procedures for monitoring of beneficiaries feedback on program effectiveness and responsiveness. Prepare recommendations for the program stakeholders. - Participate in reviewing overall national program progress with particular reference to GFATM program goals, objectives and program sustainability. - Monitor the coherency of treatment protocols for people living with HIV/AIDS according with international standards - Develop approaches for integrating HIV/AIDS, STI and reproductive health into universal health services model aimed at program sustainability.  - Promote cooperation and collaboration with the program stakeholders through conferences, workshops, round tables, newsletters etc. Promote the program in the community through various communication means including mass media."
453,Marketing Specialist,We are seeking a Marketing Specialist having work experience in related fields.,- To get acquainted with local and international tire and rubber goods market. - To represent the correspondent product to the local and international market. - To participate in different kinds of expositions. - To search partners and be in contacts with the representatives of  international similar organizations. - To perform other duties as assigned.
454,Marketing Research Assistant Intern,IATC Fund is seeking 1 or 2 individuals for part-time not paid positions of IATC Marketing Research Assistants position. Marketing Research Assistant  will help our International intern to conduct our Customer Satisfaction Analysis.,"- Making arrangement with companies and individuals - Conducting interviews in Armenian - Translating and interpreting the meetings, when it is required, - Maintaining the Survey database - Supporting with final analysis and report writing"
455,Program Manager,"Overview of the Position Armenian Caritas is seeking an experienced Program Manager for the project of Support to the development of the educational system through community involvement and participation: strengthening of Parent Councils.  Armenian Caritas will implement a three-year project, which aims to further strengthen the 40 Parent Councils and support them in identifying, recognizing, evaluating and making use of their own potential and resources.  Through the development of Parent Councils and the enlargement and effectiveness of their role, the quality of education and the quality of life within the school communities and behind will greatly benefit.","- Manage administrative procedures and policies related to program participants and project implementation.  - Manages the daily operations and administration of the program;  - Assign work responsibilities and tasks to AC members of staff working for the program, and monitor their performances. - Supervise and coordinate the program activities and be responsible for the development, implementation and monitoring of the program. - Generate regular narrative and/or fiscal reports for AC administration and project funders. - Report on weekly bases to AC Executive Director and report him/her each time a serious problem of any nature raises.    - Support and assist staff members in decision making and program implementation. - Develop, among staff members, the concept of ""team building"". Help the staff members to work together and take advantage of each other expertise. - Authorize/delegate and supervise all expenditures and financial operations related to the program. - Collaborate and support AC Senior Staff in studying and elaborating new projects proposals and implementing the Strategic Plan. - Plan and organize the participation of program staff members in training sessions and workshops."
457,System administrator,"As a System Administrator the incumbent will manage and administer Linux based hosting servers on the daily bases, create detailed system design and functional specifications as well as user specifications and FAQs, answer customers phone calls and solve technical problems by phone.","- Managing web hosting servers on daily bases - Create detailed specifications of web hosting services - Create user friendly specifications for web hosting customers - Handle web hosting customers phone calls, answer customers in polite and gentle manner - Periodically report to management on various statistics and new system needs - Research web hosting innovations and market needs local and worldwide"
458,Customer Support Representative,"As Customer Support Representative (CSR) the incumbent will be responsible for answering phone calls, e-mail enquiries and online messages from Xalts customers, meeting them, handling their requests and registering new users in the office.","- answering phone calls and e-mails in detailed and proper manner - handling technical and non technical enquiries, coordinate the technical issues with technical department for further assistance - demonstrating time management skills to prioritize  various tasks and complete the routine tasks at high level  - ensuring the customer is properly briefed on available services, making customer requirements surveys if required - working in a team on your own initiative, demonstrating strong communication skills"
459,News Content Manager,"3bids - a price search engine for computer equipment in Armenia, requires a Volunteer to maintain/update its news section from his/her preferred location","Update the news section on a daily basis on 2 languages - Russian and English (about 5-8 small news articles per day), and ensure appropriate translation."
460,Trade Show Coordinator,Trade show coordinator will be responsible for step by step organization of international and local travel trade shows representing Armenia as a tourist destination.,"- Create and maintain efficient working relationships with the Armenian tourism industry representatives and the Armenian business community supporting trade show activities - Ensure transparent announcement and application process for Armenias participation at international and local trade shows - Responsible for overall administration of all trade shows and after show follow ups - Constant effective communication with trade show participants, organizers, construction companies, transportation services and other related parties - On-site management of exhibit booth and facilitation of problems and other needs regarding space and the use of the common areas of the exhibit including insurance, cleaning, set-up and take-down - Arrangement of participants visa, transportation, accommodation and other services required for international trade show travel - Strategic planning and fundraising for further expansion of trade show activities"
461,System Administrator,"As a System Administrator the incumbent will manage and administer Linux based hosting servers on the daily bases, create detailed system design and functional specifications as well as user specifications and FAQs, answer customers phone calls and solve technical problems by phone.","- Managing web hosting servers on daily bases - Create detailed specifications of web hosting services - Create user friendly specifications for web hosting customers - Handle web hosting customers phone calls, answer customers in polite and gentle manner - Periodically report to management on various statistics and new system needs - Research web hosting innovations and market needs local and worldwide"
462,Finance Assistant,Finance Assistant is responsible for the bookkeeping of the mission.,"- Assist Finance Responsible in daily financial activities. - Use finance software, input and keep invoices received from Field Administrators. - Input in accounting software all incomes and outcomes, verify and encode vouchers received from the fields.  - Management of cashbox and follow-up of operational and other advances such as salaries, as well as other monthly payments, according to the donor requirements and instructions of other departments. - Prepare and file all the receipts and invoices for the financial reports. - Maintain local cash book. - Filing and archiving of all the financial documentation."
463,IATP Gyumri Trainer,IREX currently seeks to fill the position of a temporary part-time trainer for the Internet Access and Training Program.  The IREX/IATP trainer will be based in Gyumri and will provide management and guidance in issues concerning trainings development.,"- Oversee daily operations of the access site; - Schedule the users for open access hours and monitor the sessions of various types of end-users including USG alumni and other targeted groups identified by ECA demonstrating the technical and educational applications of the Internet; - Assist the Country Coordinator in the development of training materials and curricula, Internet resources and local language on-line development; - Assist the Country Coordinator with collecting and systematizing IATP user information, special events, success stories, and other statistics as requested by IREX; - Assist the Country Coordinator in the development and implementation of program outreach and related initiatives to foster active participation in the program by targeted audiences;  - Assist the Country Coordinator in the oversight of IREX/IATP initiatives such as web chats, PDO trainings, and publicity and program news gathering"
465,IT Capacity Building Assistant,"During the 12 months since the beginning to access and monitor the existing Information Technologies (IT) needs in the sites and Area Development program (ADP) offices, develop and implement plans and activities to build and improve IT capacities across the program.","-	Assess IT staff and equipment capacities and advise on changes that need to take place  -	Together with the IT Manager develop annual capacity building plans of ongoing IT needs  -	Prepare training materials and provide trainings for IT staff. Provide on-the-job training on Lotus Notes, LAN, File Backup & Restore to the staff.  -	Improve and upgrade computers, communication (including Radio modem, Cisco, LAN) and other office equipment as necessary. Keep IT equipment list and monitoring & evaluation form updated. -	Installation/Implementation of new computers, acquaintance with and accurate filing of the technical documentation and warranty certificates.  -	Organize warranty and post warranty service for computers when needed. -	Install/Implement and ensure uninterrupted operation and working condition of Server in the sites. -	Plan and create users and groups for giving each of them opportunity to log on in LAN and have access to necessary sources. -	Plan and implement the strategy of security for data and virus infection of LAN sources (including folders, fails and printers). -	Set up local and network printers (scanners), for giving users access to the source of printing. Solve the printing routine problems."
467,JSP/Java Developer for Lycos Mail,"The role requires dedicated JSP/Java professionals that enjoy using the latest technology in a professional environment of the Lycos Mail team. The projects concern the exciting Lycos Mail service at different European locations, like UK (mail.lycos.co.uk), France (www.caramail.fr), Germany (mail.lycos.de), Sweden (www.spray.se), with inspiring traffic numbers at 600000 received mails per hour and more than 5 million active users.","The key elements of the role are full life cycle product development working in a technically strong team through requirements gathering, architecture, development and release. The candidate is required to work closely with the other technical members of the Lycos Mail team in Yerevan as well as in Paris on new and challenging projects."
468,Java/C++ Developer for Lycos Mail,"The role requires dedicated Java/C++ professionals that enjoy using the latest technology in a professional environment of the Lycos Mail team. The projects concern the exciting Lycos Mail service at different European locations, like UK (mail.lycos.co.uk), France (www.caramail.fr), Germany (mail.lycos.de), Sweden (www.spray.se), with inspiring traffic numbers at 600000 received mails per hour and more than 5 million active users.","The key elements of the role are full life cycle product development working in a technically strong team through requirements gathering, architecture, development and release. The candidate is required to work closely with the other technical members of the Lycos Mail team in Yerevan as well as in Paris on new and challenging projects."
471,Java/C++ Developer for Lycos Communities,"The role requires dedicated Java/C++ professionals that will enjoy applying the latest technologies for solving challenging tasks in a creative, professional environment of the Lycos Communities multinational team. Current projects are dedicated to achieving our ambitious goal of strengthening and expanding our premier position in Europe and becoming the Number One on-line chat in the World.","The key elements of the role are full life cycle product development working in a technically strong team through requirements gathering, architecture, development and release. The candidate is required to work closely with the other technical members of the Lycos Communities teams."
472,JSP/Java Developer for Lycos Chat,"The role requires dedicated web developer professionals that will enjoy applying the latest technologies for solving challenging tasks in a creative, professional environment of the Lycos Communities multinational team. Current projects are dedicated to achieving our ambitious goal of strengthening and expanding our premier position in Europe and becoming the Number One on-line chat in the World.","The key elements of the role are full life cycle product development working in a technically strong team through requirements gathering, architecture, development and release. The candidate is required to work closely with the other technical members of the Lycos Communities teams."
474,Veterinarian,"- A dedicated professional, ready to provide and give advise in the field of veterinary - Scientific research - Cooperation with Government Agencies",- Professional (in the field of veterinary)evaluation of office documents - Field trips to farms  - Communication skills
476,Software Developer,"The position assumes participation in the full development and deployment cycle of software products and solutions developed by the company in collaboration with RenderX, Inc.","We expect a successful candidate to be able to  - design and develop software products, - create programs for heterogeneous environments (MS Windows, Unix), communicating by means of network protocols - author and maintain internal and end-user documentation."
484,Receptionist/ Admin Assistant,"The basic purpose of this positin is to ensure smooth communication and feedback with visitors, donor, partner and other organizations.","Responsibilities include but are not limited to the following: - Answer and screen telephone queries with discretion; take notes and make appointments  - Greet visitors  - Register and route all incoming and outgoing mails  - Draft outgoing correspondence of general and administrative character - Assist the staff in everyday routine work  - Send and receive faxes, letters and e-mails  - Maintain telephone directory  - Assist in the arrangement of receptions, workshops, training events and conferences on a range of issues related to Career Center projects."
485,Marketing Manager,The incumbent will be primarily involved in development of marketing plan for current and upcoming projects of the organization and promote the solid name of the organization in Armenia and abroad through marketing activities supported by the positions indicated skills.,Responsibilities include but are not limited to the following: - Develop a comprehensive membership system and  introduce to potential members. - Draft strategic initiatives for the Marketing and Communications activities.  - Identify new fundraising opportunities within Armenia and outside the country. - Develop and maintain good relationships with potential donors within Armenia and outside the country.  - Develop a methodology to run marketing surveys for future fundraising opportunities in Armenia and abroad; facilitate marketing survey.  - Develop cost-effective fundraising activities. - Develop annual marketing reports and present it to the Career Center staff.  - Develop and coordinate the production of all print materials relating to the Career Center. - Perform other related duties as assigned by President of the company.
486,Logistics Specialist,We are seeking two candidates for logistics specialist vacancy  with work experience with CIS countries or Iran.,"- To arrange logistics for shipment goods and imports. - To be responsible for communicating with customers, inputting customer orders. - To handle internal paperwork to process freight bills and work with accountings to ensure proper payment."
487,Training Coordinator /Assistant Project Manager,Coordinate all training and capacity building -related activities in the framework of the project to ensure the project objectives are met in a timely manner. Work in close cooperation with the Area Development Program (ADP) Manager.,"- Assess the capacity building needs of farmer associations and develop training curriculum.  - Prepare all necessary training and capacity building materials and ensure logistic provisions. - Implement capacity building programs with local training institutions. - Train community action groups in planning community development strategies and activities. - Prepare and conduct training on leadership, planning and monitoring in institutional development for farmer associations from design to implementation stage. - Prepare and conduct training of trainers and support trainer in training farmers in diverse agricultural practices.  - Train farmers and key stakeholders in participatory land use. - Provide vocational and business training to members of agricultural households."
488,Agriculture Coordinator,Facilitating diversified and market oriented agriculture development process. Coordinating and initiating off-farm income generating activities to ensure the project objectives are met. Work in close cooperation with Area Development Program (ADP) Manager.,"-	Establish demonstration plots in selected micro-catchments (landslide-prone areas, multi-purpose trees, fast-growing plantation etc). -	Set up development plots (seed banks, nurseries, fruit tree orchards, greenhouses, forage legumes) for diversified agriculture. -	Provide technical support and start-up material for developing off-farm income generating activities. -	Provide technical support and advice to Training Coordinator if required.  -	Actively participate in appropriate training materials development in line with project design and objectives."
489,Community Development Coordinator,To identify strategic issues for community development within the project framework. To coordinate community development activities in the site to insure project objectives are met. Work in close cooperation with Area Development Program (ADP) Manager.,"-	To identify, plan and support community development initiatives in infrastructure improvement -	Identify leaders and form community action groups. -	Facilitate and monitor community meetings, training sessions and other initiatives.  -	Establish a database to promote business links throughout local business centers in cooperation with IT Consultant.  -	Extensively travel throughout the targeted villages in order to maintain good working relationships and cooperation with the communities to maximize the impact of the project. -	Network with the local government and non-governmental organizations to exchange information and maximize the utilization of available resources to assist in the promotion of project activities."
490,Employment Agency Coordinator,IATC Fund is seeking an enthusiastic individual for  IATC Employment Agency Coordinators position.  Employment Agency Coordinator will also be involved in IATC Fund daily operations. 2 months probation period is envisaged.,"- Making arrangement with companies and individuals - Conducting and maintaining databases,  - Permanent search of new job opportunities,  - Maintaining good relations with companies and job seekers,  - Submission periodical reports on daily activities."
491,Secretary Referent,We are looking for a qualified Secretary/Referent to carry out general secretarial and administrative tasks.,"- Providing secretarial and administrative support to the Director and his assistants. - Answering/making telephone calls and faxing messages. - Maintain the Director's and his assistants' calendar, arranging meetings, invitations, exhibitions and other appointments. - Performing other duties as assigned."
492,Administrative Assistant,"The incumbent, under supervision of the Mission Administrator, will carry out administrative activities.","- Preparation of various administrative documents, such as contracts, orders, letters etc. - Follow up and recording employees leaves and presence sheets. - Calculation of salaries and submitting them to financial department. - Management of administrative software and sending MSF expatriates monthly checklists to headquarters in Brussels.  - Reservation and purchasing of plane tickets according to staff movement previsions. - Arranging all visa, departure/arrival procedures for MSF staff. - Follow up of office expenditure and kitchen expenses. - Work organization for MSF office and house cleaning staff, cooks and watchmen."
493,Food & Beverage Supervisor,"The restaurant supervisors main function is to promote and ensure quest satisfaction, achieved through his/her ability to develop and maintain a strong team environment, placing emphasis on associate satisfaction and delivery of prompt, courteous, correct service. The restaurant supervisor is accountable for sales and profit in his/her area. Prompt and courteous delivery of all room service orders, maintains positive room service image through all areas of guest contact and through cleanliness of work areas.",- Actively support the Quality Improvement Process.  - Assist in identifying and implementing a successful marketing plan for assigned outlets.  - Assume responsibility of daily operation of all assigned outlets.  - Assist in working towards positive financial results. - Assist in ensuring that scheduling functions are performed accurately and on a timely basis. - Assist in maintaining a highly motivated and well-trained staff
496,Web Developer,"Project Harmony, an innovate, non-profit organization that builds strong communities by fostering civic leadership, harnessing internet technology, and facilitating cross-cultural experiential learning, is currently accepting applications for positions within the Armenia School Connectivity Programs, a high profile secondary school technology in education programs of the US Department of State, Bureau of Educational and Cultural Affairs and the ZANG Armenian Legal Socialization Project, a unique project that brings together educators and law enforcement officials to create lessons in legal socialization that will be piloted in the secondary schools throughout Armenia.","WEB sites creation, programming, organization and maintenance. PHP/MySQL Data base creation, programming and maintenance, School's WEB sites administration and consultations. Interactive on-line space creation, administration and maintenance, WEB training and Consultation."
