index,Title,JobDescription,JobRequirment
944,Mobile Medical Team Officers,"SAMSA is looking for 2 Mobile Medical Team Officers (MMT Officers) for its ""Increase Access to Primary Health Care through Mobile Medical Teams"" project supported by USAID. The MMT Officers will work for Tavush and Sjunik Marzes: travel time - over 40%.","- Organize the MMT unit activities in delivery of Primary Health care through basic consultations, nutrition supplements, screening for common diseases, basic treatment and referral services to district level health care facilities;                                          - Coach MMT members and monitor their activities followed by making recommendations for and supporting the promotion of MMT effectiveness and efficiency;  Work in close relationship with MMT clerical Assistants and Monitor, control and promote the usage of the standardized program monitoring approach, keep records on program activities, regular and quality data management etc.; - Organize the MMT unit activities in delivery of Primary Health care through basic consultations, nutrition supplements, screen for common diseases, basic treatment and referral services to district level health care facilities."
945,Senior Customer Care Manager,"To build up our European Sales Support Team in Armenia, we are currently looking to recruit a Senior Customer Care Manager. In this position you will lead our Sales Support Operations based in Yerevan. This includes responsibility for the professional and effective management of our European client campaigns and customer requests as well as personnel leadership for a team of approx. 25 employees.","- Ensurance of highest possible quality of service and communication to the European sales organisations; - Information management: communication of changes in tools, new ad forms etc.; - Establishment of department performance metrics; - Initiation of new tools to optimise the departments workflow; - Customer work: efficient communication with customers/ complaint handling; - Work with direct reports to ensure they are properly trained on all systems needed to perform their job; - Ensure that team follows department practices in work flow and documentation; - Monitor campaign status reports; - Set goals for staff and evaluate performance, recruiting."
946,PHP Developer for Lycos Hosting,"The role requires dedicated and responsible Web Developers that will apply the technologies in a creative, professional environment of the Lycos Hosting multinational team.","The key elements of the role are full life cycle product development working in a technically strong team through requirements gathering, architecture, development and release. The candidate is required to work closely with the other technical members of the international Lycos Billing Platform team."
947,Ad Developer ID No. 1,"To build up our European Sales Support Team in Armenia, we are currently looking to recruit employees for the position of Ad Developer. The Ad Development Team is responsible for customising our DoubleClick DART Enterprise system and peripheral tools, as used by the Customer Care team and sales staff. Typical customisations could be to develop templates for new ad formats, test new ad formats or integrate with other systems like user databases, reporting tools, CRM systems, SAP.","- Learn and understand the DoubleClick DART Enterprise technology and functionality, understand the surrounding systems, and system architecture as it maps to our business needs; - Become an expert in customising and integrating the DoubleClick AdServer software; - Development and maintenance of our Sales supporting systems; - Programming of pre-defined project assignments."
948,Ad Developer ID No. 3,"To build up our European Sales Support Team in Armenia, we are currently looking to recruit employees for the position of Ad Developer. The Ad Development Team is responsible for customising our DoubleClick DART Enterprise system and peripheral tools, as used by the Customer Care team and sales staff. Typical customisations could be to develop templates for new ad formats, test new ad formats or integrate with other systems like user databases, reporting tools, CRM systems, SAP.","- Learn and understand the DoubleClick DART Enterprise technology and functionality, understand the surrounding systems, and system architecture as it maps to our business needs; - Become an expert in customising and integrating the DoubleClick AdServer software; - Development and maintenance of our Sales supporting systems; - Programming of pre-defined project assignments."
949,Ad Developer ID No. 2,"To build up our European Sales Support Team in Armenia, we are currently looking to recruit employees for the position Ad Developer. The Ad Development Team is responsible for customising our DoubleClick DART Enterprise system and peripheral tools, as used by the Customer Care team and sales staff. Typical customisations could be to develop templates for new ad formats, test new ad formats or integrate with other systems like user databases, reporting tools, CRM systems, SAP.","- Learn and understand the DoubleClick DART Enterprise technology and functionality, understand the surrounding systems, and system architecture as it maps to our business needs. - Become an expert in customising and integrating the DoubleClick AdServer software. - Development and maintenance of our Sales supporting systems. - Programming of pre-defined project assignments."
950,Project Manager/Co-ordinator,"The role requires dedicated and responsible person. As a Project Coordinator you will be the key of communication, and make sure to support the Project Manager in the whole phase of our projects. The role requires a person that is self going and communicative.","As a Project Coordinator you will be responsible for tasks such as meeting notes, planning parts of the project, communication to our development centers in Europe."
955,Quality Assurance Assistant,CIT is looking for a Quality Assurance Assistant to support QA department daily operations.,"- Process the orders and required documentation flow; - Advise the company personnel; - Support, develop and execute appropriate QA policies; - Support of the dynamic organizational structure."
957,Developer Ad Technology ID No. 1,"To build up our Engineering Team in Armenia, we are currently looking for motivated technical persons to take over a new position as a Developer. You will belong to a young and dynamic team working on the advertising system (named DART Enterprise) and its existing interfaces. You will work on very different projects like customisation of the system, building of complex new interfaces, further development of our reporting tools, technical support to our Sales departments, etc. During these projects you will also work together with your colleagues in different European countries. Do you have fun by solving technical problems? Are you able to handle multiple priorities and to approach the issues analytically? Can you work independently in a European organisation?  If yes, you are definitely the right person for this job and we are looking for your application!","- Learn and understand the AdServing technology (DART Enterprise), its functionality and then understand the surrounding systems and the system architecture as it maps to our business needs; - You will become an expert in customising and integrating the AdServer software; - You will also be the technical key contact person for the trafficking team in Armenia to support them for all technical purposes (for example problem solving regarding creatives, new advertising format implementation/ coding, write templates, mapping files, etc.); - You will support us for our technical projects with your expertise."
958,Ad Developer ID No. 3,"To build up our Engineering Team in Armenia, we are currently looking for motivated technical persons to take over a new position as a Developer. You will belong to a young and dynamic team working on the advertising system (named DART Enterprise) and its existing interfaces. You will work on very different projects like customisation of the system, building of complex new interfaces, further development of our reporting tools, technical support to our Sales departments, etc. During these projects you will also work together with your colleagues in different European countries. Do you have fun by solving technical problems? Are you able to handle multiple priorities and to approach the issues analytically? Would you like to lead projects and work together with very international teams? If yes, then you are definitely the right person for this job and we are looking for your application!","- Learn and understand the DoubleClick DART Enterprise technology and functionality, understand the surrounding systems, and system architecture as it maps to our business needs; - Become an expert in customising and integrating the DoubleClick AdServer software; - Develop and maintain our Sales supporting systems; - Program pre-defined project assignments."
959,Developer Ad Technology ID No. 2,"To build up our Engineering Team in Armenia, we are currently looking for motivated technical persons to take over a new position as a Developer. You will belong to a young and dynamic team working on the advertising system (named DART Enterprise) and its existing interfaces. You will work on very different projects like customisation of the system, building of complex new interfaces, further development of our reporting tools, technical support to our Sales departments, etc. During these projects you will also work together with your colleagues in different European countries. You will be a technical key contact person for the users of the tool and will support them for all technical purposes. You will be our programmer for new pre-defined project assignments that are planned.Do you have fun by solving technical complex problems? Can you approach the problems and the requirements in a systematic and detailed manner? Do you enjoy working in a team as a key player? Are you able to drive important projects successfully and to document your work? If yes, you are definitely the right person for this job and we are looking for your application!","- Learn and understand the AdServing technology (DART Enterprise), its functionality and then understand the surrounding systems and the system architecture as it maps to our business needs; - Become an expert in customising and integrating the AdServer software; - You will be our key contact person for our reporting system and will be responsible for its maintenance and all further technical developments in the tool."
960,Senior Developer Ad Technology,"To build up our Engineering Team in Armenia, we are currently looking for a motivated technical Senior Developer. You will belong to a young and dynamic team working on the advertising system (named DART Enterprise) and its existing interfaces. As a team leader you will work on very different projects like customisation of the system, building of complex new interfaces, further development of our reporting tools, technical support to our Sales departments, etc. You will drive projects in a rapidly changing environment and will have to work effectively with people across the organisation. You will be our expert regarding the architecture and functionality of our AdServer system and will have an excellent understanding of its technical capabilities. You will be our technical project manager for complex technical projects which require technical experience and a strong and varied knowledge. To be successful you need to have the ability to engage complex business and technical challenges confidently in order to make the right tradeoffs.  Are you an outstanding decision maker? Are you able to assign tasks with an excellent planning of skills and give precise instructions? Do you work goal oriented and have an excellent faculty of judgement and thinking? If yes, then you are definitely the right person for this job an","- Learn and understand the AdServing technology (DART Enterprise), its functionality and then understand the surrounding systems and the system architecture as it maps to our business needs; - Become an expert in customising and integrating the AdServer software; - Prepare the technical recommendations and define our technical specifications taking our business requirements into account for development projects, assign the resources correctly; - Completion of development projects within agreed time-frames. Perform work planning, development, and second level support for business departments."
965,English - Armenian Language Translator/ Interpreter,Provide quality and in time (mostly  verbal) translations and interpretations to/from English and Armenian languages.,"- Extensive translations/interpretations in the sphere of commercial, technical, social and financial affairs at meetings; - Translations of documents."
967,C++/ C# Senior Developer,The primary objective of this position is to produce required product in conjunction with team members.,- Gather and produce requirements and designs; - Write and test code for the required product; - Accurately plan software development activities and follow established processes; - Communicate effectively with management and also team members; - Actively participate in discussions regarding technical issues.
968,Technical Recruiter,"The primary objective of this position is to support recruiting processes and provide superior customer service to applicants, candidates and hiring team.","- Utilize and maintain a comprehensive database of candidates and contact information; track movement of applicants and candidates over time; - Coordinate cross-functional data tracking; - Enter and maintainsdata/information for metrics management; - Research options for sourcing in specific geographic areas; - Coordinate advertising efforts; - Assist in managing vendor and university relationships  Alumni organizations; - Assist in the coordination of job fairs, open houses and receptions; - Coordinate the ordering, delivery and set up of materials for recruitment events; - Keep the recruitment process moving  address stalls in the process (i.e. resumes not being reviewed, tests not being evaluated); - Screen resumes; - Administer assessment tests; - Schedule interviews and follow up with candidates and managers; - Conduct employment reference and background checks; - Enter new hire information into internal systems; - Generate offer letters; - Participate in new hire orientations; - Ensure closed job files are complete and meet legal, regulatory and audit compliance requirements; - Assist in coordinating postmortems for the recruitment, selection and integration processes."
969,C++/ C# Senior Developer,The primary objective of this position is to produce required product in conjunction with team members.,- Gather and produce requirements and designs; - Write and test code for the required product; - Accurately plan software development activities and follow established processes; - Communicate effectively with management and also team members; - Actively participate in discussions regarding technical issues.
970,Designer/ Architect,We are looking for a dedicated person ready to fulfill the position of the Designer/ Architect.,- Draw up projects for buildings; - Represent and discuss the projects with the leaders of the building company.
971,Executive Director,"We are looking for a dedicated person, ready to fulfill the position of an Executive Director at a store.",- Lead and manage the works of the store; - Be in charge of the whole store operations; - Organize the daily works.
972,Public Policy Specialist,"Working closely with the Deputy Program Director, the Public Policy Specialist will provide guidance and technical assistance in the areas of research and analysis to support legislative activity including both consideration of legislation, the state budget and legislative oversight. In partnership with counterparts, the Public Policy Specialist will work to provide targeted assistance in enhancing the internal capacity within the National Assembly as well as effective mechanisms for drawing upon external expertise. This includes working closely with short-term project consultants and assisting with the design and implementation of workshops, drafting reports and recommendations and developing tools for enhanced procedures and conducting training.","- Work with the counterpart to develop mechanisms and systems to institutionalize linkages between standing committees, research and analysis units, and policy experts both within ministries and from institutions outside government structures; - Work with the Deputy Program Director to assist standing committees, legislators, and staff in employing new methods and practices for analyzing legislation including budget analysis;  - Provide long-term assistance and coordinate short-term technical assistance to the National Assembly in gauging the impact of legislation on societal groups and in conducting fiscal, environmental, and gender-based policy analysis; - Participate in designing and implementing training programs for National Assembly staff and elected deputies as well as training programs for individuals and organizations working with parliament; - Oversight and management of policy analysis and research studies; - Working as part of a team, coordinating with all project personnel and other donor projects to ensure complimentary activities."
973,Printing/Publishing Assessment Consultant,The Printing/Publishing Assessment Consultant will conduct a cost/benefit assessment of a proposal on enhancing the in-house printing/publishing capacity of the National Assembly of the Republic of Armenia to the extent that from a technical standpoint outsourcing (utilizing outside printing/publishing companies) would no longer be necessary.,"The incumbent will gather information through working with and interviewing key actors from, inside and outside of the National Assembly to determine in a written report:  - the costs of proposal implementation including initial as well as annual maintenance costs including spare parts needs; - the annual costs that the current mode of operations entails in which the National Assembly makes use of its current duplicating and printing equipment for less complex pamphlets while more complex and longer publications are printed using outside printing companies;      - the type and costs of training National Assembly staff would need to maintain any newly acquired printing equipment in working order;  - the current annual number of publications being printed under National Assembly auspices whether through in-house or outside printing; - whether this proposal would increase the current number of publications printed under National Assembly auspices and thus, better serve the Armenian legislative community; - the degree to which outside printing companies are currently and in the future will meet the printing needs of the National Assembly."
974,Program Assistant,"The Program Assistant will report to the Field Assistant in Armenia. He/she will be responsible for monitoring Heifer projects, community mobilization and agricultural training components of the project and for support to project holders. The Program Assistant will be assisting the Field Assistant in Armenia for defining, assessing and implementing the technical assistance needs of beneficiaries. The position includes 50% of the regional travel in Armenia.","- Mobilize rural communities, educate and train them to become eligible for Heifer projects development; - Work with project holders to collect data on social-economic status of beneficiary families in targeted communities; - Educate, train and advise community groups; - Train community groups the developing plans for agriculture projects; - Monitor implementation of a comprehensive technical assistance program for beneficiaries; - Provide in time reliable and valid data reflecting progress in Heifer projects in Armenia; - Assist in other areas when needed."
975,Administrative Assistant,"To provide administrative assistance to Heifer Caucasus Regional office in Yerevan and the Director, ensuring daily office operations are carried out efficiently and effectively. This position will include administrative support and office management functions. The Administrative Assistant will report to the Heifer Caucasus Regional Director.","- Ensure quality translations of written documents in English, Armenian and Russian languages;   - Provide oral translations as needed; - Design and maintain office reception area; - Respond to the telephone calls; - Receive visitors and refer to relevant staff if needed; - Schedule appointments for key staff; - Coordinate and/or facilitate arrangements for travel, meetings, conferences and training workshops, including local transportation, by working with office logistician and the drivers; - Maintain office files and records; - Copy and fax materials; - Maintain Heifer Caucasus web-site as requested; - Assist with special projects as requested; - Perform other job-related duties as requested."
976,Electrical Engineer,"Design, inspection and supervision of Electromechanical Studies and Works.","Responsible for design of electromechanical infrastructure, for GSM Telecom equipment, as well as for supervision of related sub-contracting works."
977,Telecommunications Installation Engineer,"Installation and Engineering of GSM Telecom Equipment (Radio Base Station, M/W Links).","Apply appropriate engineering skills, with emphasis on telecommunication equipment engineering and drawings regarding installation studies."
978,Telecommunications Engineer,"Commissioning and Maintenance of GSM Telecom Equipment (Radio Base Stations, M/W Links).","On-field start-up, testing, measurement and maintenance activities for implementing a GSM Network."
979,Lawyer,We are seeking for a qualified Lawyer to work for an NGO.,- Answer the phone calls; - If necessary protect the rights of clients in the court; - Explain clients their rights.
985,General Practitioner,"Cascade Capital Holdings (CCH) CJSC is looking for a motivated, self-driven, highly professional candidate for the position of General Practitioner.  We are looking for well organized and hard working persons able to work in a western-style office environment towards the achievement of team goals.",- Provide medical advise and services to the insurance trading division customers; - Other general medical advice on the CCH level.
987,English Language Instructor,We are expanding our Language Center activities and are looking for more qualified language specialists. Under the overall supervision of the Language Center Director the Language Instructor will develop and conduct language classes.,- Develop a comprehensive curriculum plan and language materials to cover every knowledge level; - Develope and conduct language pre-orientation tests; - Conduct language classes. - Develope and cunduct course accmoplishment grading tests.
988,Accountant,"The Foundation needs a qualified Accountant, who will be responsible for the complete accounting of the organization.",- Financial reports control; - Maintain banking records and running balance. Prepare projected expenses and wire transfer requests; - Prepare reports to tax authorities and head office; - Enforce financial control systems including  petty cash management; - Assist in financial evaluation of proposals; - Other tasks as requested by the Director.
