index,Title,JobDescription,JobRequirment
0,Chief Financial Officer,"AMERIA Investment Consulting Company is seeking a Chief Financial Officer. This position manages the company's fiscal and administrative functions, provides highly responsible and technically complex staff assistance to the Executive Director. The work performed requires a high level of technical proficiency in financial management and investment management, as well as management, supervisory, and administrative skills.","- Supervises financial management and administrative staff, including assigning responsibilities, reviewing employees' work processes and products, counseling employees, giving performance evaluations, and recommending disciplinary action; - Serves as member of management team participating in both strategic and operational planning for the company; - Directs and oversees the company's financial management activities, including establishing and monitoring internal controls, managing cash and investments, and managing the investment portfolio in collaboration with the Investment team leader. This includes, but is not limited to, evaluation of investment risk, concentration risk, fund deployment levels, adequacy of loss and liquidity reserves Assists investment team in development of proper documentation and internal systems; - Directs and oversees the annual budgeting process, including developing projections for financial planning, and preparing budgets; - Prepares external and internal financial management reports, such as audited financial statements, tax returns, and reports for the board of directors and company staff; - Develops, implements, and maintains efficient and effective accounting systems and controls to ensure compliance with national and international accounting standards and principles, sufficiency of fund accounting, and comprehensiveness of data for reporting and compliance requirements; - Ensures contract compliance, including interpreting and monitoring contracts with clients, submitting required reports, and monitoring covenants and other contract terms; - Oversees the design, implementation and maintenance of computer-based information system. Oversees records retention (both manual and computer-based) and file maintenance activities; - Serves as company's risk manager, including evaluating loss exposure and obtaining insurance as appropriate; - Manages other administrative operations, such as facilities management, payroll administration, office operations, and administrative support; - Monitors corporate compliance with by-laws and articles of incorporation regarding corporate registration and reporting of fundraising operations."
2,Country Coordinator,"Public outreach and strengthening of a growing network of environmental NGOs, businesses, international organizations and public agencies. Will serve as primary contact between CENN and public. This is a full-time position.","- Working with the Country Director to provide environmental information to the general public via regular electronic communications and serving as the primary local contact to Armenian NGOs and businesses and the Armenian offices of international organizations and agencies; - Helping to organize and prepare CENN seminars/ workshops; - Participating in defining the strategy and policy of CENN in Armenia, the Caucasus region and abroad."
3,BCC Specialist,"The LEAD (Local Enhancement and Development for Health) BCC Specialist will apply state-of-the-art approaches in working with LGUs (Local Government Units) and NGOs to help them to identify and address provider-caused barriers to service provision as well as to identify and address supports for good service delivery by developing tools that may be adapted to each LGU's needs. S/he will work with LEAD staff across all components to support quality service delivery and will also monitor implementation of improved service delivery in LGUs, and will provide additional assistance to LGUs and NGOs, as needed. S/he will collect all relevant published and grey literature documents, identify gaps in knowledge, and work with NGOs and consultants to fill in the gaps. S/he will establish training for NGOs and LGU administration staff pursuing service enhancement and provider behavior change and will oversee the training. S/he will serve as the Project's primary liaison to TSAP and other projects and organizations working in behavior change.","- Identify gaps in knowledge and overseeing information collection to fill them; - Consolidate partnerships with center of excellence of technical support, working with local NGOs/COs, LCEs, and LGUs; - Work with LEAD team to develop assessment tools for LGUs to identify barriers and supports to quality service provision; - Assist LGUs and NGOs to design and implement multifaceted (if necessary), systematic interventions, based on assessment results, to enhance quality service provision, especially through provider behavior change. For example, ensure that not only providers, but their supervisors are trained and that monitoring and supervisory systems promote provider change, quality services, and sustainability of change; - Assist other LEAD specialists and units to enhance the quality of services, especially through BCC and provider behavior change, and assure that programs serve community needs; - Oversee and, when practical, co-facilitate behavior change training activities and proposal development and coordinate these activities, as needed, with other project components and counterpart agencies; - Participate in developing programs to address common barriers (e.g., strengthen service providers' interpersonal communication skills through on-the-job training and use of innovative training approaches based on TSAP-FP and other projects' approaches); - Provide training to local groups in developing programs in community mobilization and advocacy to participate in health planning process;  - Develop monitoring and evaluation systems for client-centered quality care/ provider behavior change; - Reinforce inter-organization collaboration and coordination of BCC interventions to improve the overall quality of interventions; - Serve as primary LEAD liaison with BCC agencies, projects, and consultants."
13,"Community Development, Capacity Building and Conflict","Food Security Regional Cooperation and Stability Programme in South Caucasus (FRCS) is seeking applications for the position of Community Development, Capacity Building and Conflict Management Consultant.","- Assist the Tavush Marz communities and community unions in developing and strengthening their capacities and structures of local self governance; - Identify impacts and further needs for capacity building measures at local level including civil society actors; - Conduct surveys, analysis and monitoring of local conflict and make necessary recommendations; - Organize meetings, discussions and prepare reports (in the Armenian, Russian and English languages)."
17,Country Economist (NOB),The United Nations Development Programme in Armenia announces opening for the position of  Country Economist.,"The incumbent under direct supervision of UNDP Resident Representative will be responsible for the following issues: regularly track economic data, undertake periodic analyses of economic and development issues and produce relevant reports aimed at promoting equitable economic growth and human development; advocate for the Millennium Development Goals, Human Development and equitable economic growth by participating in relevant forums, conferences and trainings; manage the production and launch of economic reports, including White papers and National Human Development Reports; provide high quality economic input to all relevant UNDP programmes and projects and ensure that UNDP programmes are in line with national ""policies and priorities; provide capacity building support in economic management to public institutions; assist the efforts of the Government and UNDP to mobilize resources by preparing documentation for donor and consultative meetings; facilitate policy dialogue on economic issues with the Government, private sector, civil society and donors; contribute to sub-regional, regional and inter-agency initiatives related to development issues."
18,Driver/ Logistics Assistant,Driver/ Logistics Assistant is a full-time national staff position based in CHAP Yerevan office. Five day work week.,"- Maintain CHAP/Armenia pool of vehicles and personal vehicle in working condition and in a high degree of readiness; - Operate CHAP/Armenia pool of vehicles and personal vehicle; - Report about use of CHAP/Armenia and personal vehicles; - Help maintain the CHAP/Armenia warehouse; - Help manage all aspects of the project implementation, including humanitarian assistance customs clearance, unloading, inventorying, distribution, monitoring, and providing feedback information; - Carry out spot-checks of recipient organizations for two years after assistance has been provided as assigned by CHAP/Armenia Country Program Director; - Help identify recipients and their needs within the project framework; - Help professionally answer telephone calls while in the CHAP/Armenia office; - Record photographically most effective use of HA items by recipient organizations; - Help prepare and submit to CHAP/Armenia Country Program Director feedback information about use of HA; - Perform other duties as assigned; - Report to CHAP/Armenia Country Program Director."
19,Graphic Designer,"The position of Graphic Designer (GD) demands a proven, successful experience in the field of ""new media"". The design and communication concepts that you have created since completing your studies are proving to be popular.",Graphic Designer will be responsible for every graphical development of our software and websites; from general user interface to product packaging including user guide documentation; will assist the marketing and communication team to develop the corporate material for the group and its subsidiaries; will also create marketing presentations for both in-house and client projects.
20,Administrative Assistant,"This is an excellent opportunity for the right person to join CUTS Centre for International Trade, Economics and Environment, London. CUTS (Consumer Unity & Trust Society) is a charitable organisation, with its headquarters in Jaipur, India, working at the local, national, regional and international levels, and has recently opened an office in London. The London office will coordinate and manage research and advocacy work on trade and economic issues and will also support other offices of CUTS by raising funds, organising events, etc. The organisation is concerned with the impact of international trade and economic regime on developing countries and advocates for the poor at different levels. The position will involve providing support for all these activities. Applicants must have experience in office administration.","- Responsible for managing office administration, including accounts, etc.;  - To provide administrative support to other staff (set-up and maintenance of the filing system, organising travel, events, etc); - Manage office communications (written, electronic and telephonic); liaison work with funding agencies, CUTS offices in other countries, other organisations, individuals; dealing with enquiries, etc.; - To manage general administration, including safety-related issues, human resources-related issues, etc.; In addition to responsibilities outlined above, the post will occasionally entail duties outside the normal working hours, such as managing events, accompanying visitors, working to meet deadlines, etc. Flexibility and good humour are essential."
22,Marketing Advisor,"The Marketing Advisor will lead the project in identifying and developing market opportunities, helping to develop Georgian capacity to structure deals, nurture the commercial skills of existing entrepreneurs, attract investment partners and facilitate increased agribusiness activities. The Marketing Advisor will be based in Tbilisi, Georgia with extensive travel throughout Georgia and the surrounding region.","- Lead the effort to identify targets of opportunity; primarily market-based but also taking into consideration Georgia numerous micro-climate opportunities; - Formulate and direct the implementation of market research, investigation and analysis which provides the foundation for identifying, assessing and developing targets of opportunity; - Provide the vision for conceptualizing commercial strategies for the potential targets of opportunity and lead in the formulation of market chain development strategies; - Direct the preparation of pre-feasibility and select feasibility level investigations and drive the process of packaging viable business opportunities which when implemented will result in successful commercial transactions and fully functioning market chains; - Play a key role in identifying strategic partners, both operational and investment; - Determine the market related facilitations that are needed to support the implementation of the packaged business opportunities and deliver these facilitations; my relate to linking buyers and sellers, direct involvement in trading and brokerage activities, formulating marketing strategies, developing branding programs, preparing promotional materials and programs, etc.; - Establish and build the capacity of two teams within the Marketing pillar: 1) Market Identification and Development Team; and, 2) Agribusiness Planning Team; - Together with the Processing Advisor, establish a central information center to house production, processing and marketing related technical information, as well as business and financial planning and management resource material; identify and subscribe to appropriate electronic market information databases; - Oversee the design and implementation of an appropriate Market Information Service for the Georgian agribusiness sector; - Select and facilitate client/ staff participation in appropriate international trade exhibitions; - Formulate and execute marketing-related training program for Georgian agribusinesses and local marketing team; - Build capacity to structure deals; - Formulate staff development programs for Marketing Team and take responsibility for supervision."
23,Chief/ Supervisor of Programs Department,"The candidate will work for the promotion and development of the company's activities. The Supervisor will also work in close collaboration with special departments and be responsible for their monitoring. The candidate will supervise and organize programs, develop work plans and perform other duties project requires.",- Overall management of operation and direction of the department;  - Manage project staff and subcontractors;  - Develop and implement work plans;  - Develop and maintain a strong professional relationship and ensure accurate documentation of communications and instructions.
25,Deputy Program Director,"Project Harmony, an innovative, not-for-profit professional exchange and training organization with 13 offices across the US, Armenia, Azerbaijan, Georgia, Russia and Ukraine currently seeks an experienced, mature professional to fill the position of Deputy Program Director for the Armenia School Connectivity Program (ASCP), a program of the Bureau of Educational and Cultural Affairs of the US Dept. of State administered by Project Harmony. This position is based in Yerevan, Armenia with extensive regional travel. Fluency in Russian and/or Armenian is essential. Project Harmony seeks to fill this position as soon as possible.  Project Harmony is an equal opportunity employer, which provides its staff opportunities for job growth, innovation, and creativity.","- Assist the Program Director in all aspects of program management, including program design, implementation, reporting, promotion and evaluation; - Establish and maintain relationships with Armenian and international working partners;  - Oversee financial accounting and reporting;  - Assist Program Director with staff and financial management and provide direct oversight of 2-3 departments; - Coordinate with the Public Affairs Section of the US Embassy in Yerevan;  - Lead reporting and promotional activities in tandem with fellow DPDs;  - Communicate regularly with PH management and program advisors in the US;  - Travel throughout the region for program implementation and cross-programming initiatives;  - Develop program and organizational promotion and publicity;  - Research opportunities for new/continuing program development in Armenia."
30,Consultant (short-term),International Relief and Development (IRD) Armenia Branch urgently seeks a qualified individual to fill in a short-term position of a Consultant to conduct a feasibility study in an agricultural sector.,Consultant will develop a clear and thorough understanding of a certain product's local consumption and in future years consumption in neighboring countries. To do this he/she will prepare a clear analysis of the national and regional supply and demand of this and related consumer products. The analysis should answer the following questions concerning: - Supply and Demand Situation; - Economic Analysis of Canning and/or packaging of a new product  in Armenia; - Market Introduction and Acceptability Procedures.
32,Training Officer,"The United Methodist Committee on Relief (UMCOR) Armenia is seeking applicants for the position of Training Officer for ""Prevention and Control of HIV/AIDS and STIs"" Project implemented in Gegharkunik marz. The goal of the project is to reduce the risk of HIV/AIDS, STIs and TB among rural communities by promoting behavioural changes and strengthening the health care system's management of STIs.","- Participate in needs assessment for the selection of program villages in targeted region; - Work with community leaders, local authorities to organize selection of community health volunteers (CHVs) and to coordinate their activities; - Develop training curriculum and training modules for CHVs; - Conduct trainings of CHVs; - On regular basis monitor the quality of implementation of the program; - Travel on a regular basis to all target communities 70% of the workload consists of fieldwork."
36,Tester,"Synergy International Systems, Inc./Armenia is currently seeking self-motivated individuals to join our quality assurance team. The ideal candidate will meet the following basic requirements:","- Testing software at all levels; - Analyzing and reporting test results; - Working independently with the aim of creating a test environment; - Creating and maintaining test definitions and specifications; - Automating test procedures and writing test automation scripts; - Creating templates based on test results; - Analyzing software performance and reporting data metrics; - Developing best-case test scenarios; - Debugging, analyzing and fixing application problems/ issues."
37,Receptionist,AMERIA Closed Joint Stock Company is seeking a Receptionist to provide secretarial and administrative support to the office.,"- Handling call center receptionist duties in polite and courteous manner; - Collecting, sorting, distributing and filing incoming and outgoing correspondence, reports and other materials and transmit correspondence, documents, etc. via electronic mail, fax, courier service or other means of communication; - Typing and formatting a variety material including correspondence, reports, meeting papers,  minutes and protocols, faxes, statistical tables or tabular material; - Operating a variety of office equipment such as photocopier, facsimile, scanner and other peripherals; - Handling large volume of work quickly and accurately under time constraints; - Systematic and accurate handling of confidential material with discretion; - Courtesy, tact and ability to work effectively with people of different national and cultural backgrounds, receive telephone calls and office visitors and refer them to the appropriate source or reply personally to queries when possible or if required."
42,Receptionist,AMERIA Closed Joint Stock Company is seeking a Receptionist to provide secretarial and administrative support to the office.,"- Handling call center receptionist duties in polite and courteous manner; - Collecting, sorting, distributing and filing incoming and outgoing correspondence, reports and other materials and transmit correspondence, documents, etc. via electronic mail, fax, courier service or other means of communication; - Typing and formatting a variety material including correspondence, reports, meeting papers,  minutes and protocols, faxes, statistical tables or tabular material; - Operating a variety of office equipment such as photocopier, facsimile, scanner and other peripherals; - Handling large volume of work quickly and accurately under time constraints; - Systematic and accurate handling of confidential material with discretion; - Courtesy, tact and ability to work effectively with people of different national and cultural backgrounds, receive telephone calls and office visitors and refer them to the appropriate source or reply personally to queries when possible or if required."
44,Quality Assurance/ Health Systems Management Advisor,Initiatives Inc. seeks a Quality Assurance/ Health Systems Management Advisor for a multi-year assignment.,"- Provides technical and managerial leadership for primary health care improvement and management systems development; - Provides technical assistance for certification and accreditation; - Designs and manages program activities; - Manages administration, finances and staff; - Collaborates with partners at MOH; - Provides managerial support to COP; - Coordinates annual workplans, project reporting, and project reviews for QA, HR and management activities .Assists COP in ensuring that USAID requirements are met; - Works with senior management team to develop annual work plans .Builds the capacity of local staff to manage project activities."
50,Programs Manager,"Armenian Caritas is seeking an experienced Programs Manager to lead the development of programs and coordinate the design, documentation, monitoring, and evaluation of program activities for the purpose of assuring the ongoing quality. He/she will be fully aware of all aspects of all projects and will provide leadership and guidance to the program team (Project Managers and Project Staff).","- Monitor the overall programs performance and impact and coordinate the various Project activities; - Develop indicators and procedures for each project with each project manager; - Provide input into project design and implementation of AC programs; - Provide effective program leadership and guidance to the project managers; - Prepare the fiscal year operational plans and ongoing strategic planning to insure project initiatives remain appropriate, responsive, high in quality, focused and realistic; - Ensure the collection of appropriate baseline, data collection and surveillance systems for enhanced operational efficiency and effectiveness; - Evaluate the evolving status of the beneficiary population, verifiable measurements of achievements against program objectives; - Prepare implementation plans with project managers that measure quantitative and qualitative accomplishment of objectives; - Ensure that monthly and mid-term reports reflect verifiable measurement impact and accomplishment in accordance with the implementation plan; - Prepare executive summery report for board meetings; - Conduct project evaluations for maintaining quality, relevance and impact; - Monitor initiatives with the Project Managers; - Regular field visits to various project sites for the purpose of project evaluation/ monitoring; - To organize trainings for the technical personnel in the areas of project design and implementation; - Work with the Executive Director and Finance Manager to monitor fiscal year expenditures in relation to the accomplishment of project objectives; - Supervise the Project Managers and the projects staff; - Recommend trainings that would enhance the capacity of the program team; - Assure timely and quality reporting on to the partnership and donors; - Report on the progress of projects and initiatives to the Executive Director and PR Responsible; - Liaise with Donors, for program orientation, acquisition of resources and other issues; - Assure good collaboration with all donors, international and local NGOs and community entities."
51,Proposal Writer,Armenian Caritas seeks to hire a full-time Proposal Writer to develop and design the new projects and help the organization to achieve its strategic goals.,"- Researching funding sources, developing and writing proposals in collaboration with Program Managers and other staff members;  - Preparing grant applications and supporting documentation (charts, maps, slides, photographs and other visual aides) to ensure compliance with funding requirements, including researching demographic, statistical and factual data necessary for the applications, in all areas;  - Maintaining records for grants for compliance with applicable regulations and policies;  - Assisting in the implementation of the organization's strategic goals related to the program development;  - Lending assistance as needed with other development tasks, such as special events and donor solicitation;  - Attending meetings with senior staff."
