index,Title,JobDescription,JobRequirment
1320,Public Relations Coordinator,"Save the Children Armenia Field Office is seeking an appropriate candidate for a Public Relations Coordinator for all Field Office programs. The PRC is responsible for the production of communication materials for Save the Children Armenia Field Office. The communication and publicity materials include but are not limited to press releases, brochures, leaflets, web site information, program reports and success stories. The main users of the information materials are donors, government and local authorities, partner organizations, Save the Children FO staff, SC/headquarters and the public.  The PRC periodically updates AFO publicity materials and is responsible for drafting AFO quarterly contributions to newsletters for Save the Children, USAID and the US Embassy, and for maintaining regular communication about AFOs achievements with donors and other groups.","- Develop, maintain, update and edit presentation materials, brochures, leaflets and websites related to Field Office programs. Ensure high quality of the content and visibility of presentation materials. Travel to project sites, photograph progress of the projects and report to the management about problems noted, if any. Maintain before and after photo albums for each project site. Provide brief information on the progress of projects; - Assist in organization of project events. Attend project events, photograph events and write success stories based on actual achievements of projects; conduct interviews with community members, beneficiaries, relevant Marz officials and community project leaders to gather information related to the project. Write press releases and other presentation materials to ensure proper coverage of events; - Correspond with USAID and the US Embassy and provide them with Bi-Weekly Bullets of Save the Childrens events and achievements. Compose and compile the Field Office contribution to Save the Childrens quarterly regional newsletter. Prepare information materials for the SC headquarters; - Assist all SC project teams in writing the Success Stories section of programmatic reports for donors, SC headquarters, government and other stakeholders. Maintain and periodically update the FO Capacity Statement document; - Maintain communications with individual and corporate sponsors and provide them with reports on sponsored projects; - Performance of other outreach tasks as assigned by the Country Director."
1321,Gender and Youth Programs Specialist,"Under direct supervision of the CARDs Rural Development Manager, the Gender and Youth Programs Specialist is responsible for creating and implementing rural gender and youth development projects.  This position is located within the CARDs Rural Development Department.","- Responsible for the identification, preparation, implementation, and appraisal of gender and rural youth development projects; - Implement innovative ideas for promoting women-driven initiatives in a development context;  - Manage a U.S. 4-H style Rural Youth Program based on Youth Clubs in all regions of Armenia already established by the United States Department of Agricultures Marketing Assistance Project; - Provide leadership to a team of project personnel, invited experts, and cooperating partners working on youth projects;   - Initiate systematic needs assessment to identify specific problems and opportunities that require technical assistance in this field; - Develop an annual program and appropriate budget for CARDs Rural Youth Development program; - Prepare regular progress reports, and an annual impact report that can be integrated into CARDs overall Strategic Result Framework;  - Manage and supervise grant programs for all women-lead businesses, dairy, crafts, and environmental protection/other Youth Clubs, as well as educational activities; - Develop subject-oriented training for adult leaders, youth, and volunteers;  - Foster collaboration with foreign assistance and donor organizations relative to rural development initiatives; - Start a Young Entrepreneur Development program for CARD, encourage youth businesses in rural areas, and provide training to youth and young adults (under 30 years of age) interested in beginning their own businesses; - Develop and organize international youth exchange programs and workshops; - Initiate collaboration between Education/Research Institutions, Regional Agricultural Support Centers, International advisors, farmers, agribusinesses, and Youth Clubs to benefit youth and gender development; - Develop and disseminate project announcements, publications, and training materials; - Network with National Extension specialists and other stakeholders; - Perform any other duties requested by the supervisor."
1324,Controller,The emphasis of this position is the implementation of all central controlling instruments and processes in our Armenian subsidiary as well as the consultation and support of the local resident managing director. The incumbent will pass a training period for a duration of 3 month which will take place in our German headquarter in Guetersloh/ Germany.,"- Implementation of planning, controllings and reporting systems and processes; - Support the business reporting and indicative systems like budget planning sheets and forecasts; - Analysis of abnormalities and plans within the monthly, quarterly and yearly reports; - Advise appropriate measures; - Conduct financial economical and statistic analyses; - Analyse costs and deliveries in order to formulate recommendations for trading; - Support the Armenian subsidiary with the budget planning, reporting and cost control."
1325,Flash Action Scripting Programmer/ HTML Coder,"Koan Technologies is looking for a skilled Flash Action Scripting Programmer for a long-term project requiring traveling to the Brussels, Belgium.",- Integrate into a development team based in Belgium;  - Contribute to the development of key elements of a large risk management platform in relation with the user interface and user oriented modules.
1327,Senior Lending Officer,"Cascade Credit CSJC universal credit organization, a member of Cascade Capital Holdings CJSC, is looking for a motivated, self-driven, highly professional candidate for the position of Senior Lending Officer.  We are seeking a well organized and hard working person able to work in a western-style office environment towards the achievement of team goals.",- Lead the lending process; - Comply with local regulations and company policies; - Report to the Executive Director of Cascade Credit; - Create a constant pipeline of quality loan applications; - Manage customers relationships;  - Analyze and verify applicants financials to determine creditworthiness;  - Manage collections; - Initiate collateral liquidation in the event of borrower default;  - Liaise with Legal and Risk Management departments; - Design and introduce innovative new products.
1329,Mobile Medical Team Officer,"SAMSA is looking for a Mobile Medical Team Officer (MMT Officer) for its ""Increase Access to Primary Health Care through Mobile Medical Teams"" project supported by USAID. The MMT Officer will work for SAMSA Yerevan office with travelling to Gegharkunik marz (travel time - over 50%).","- Organize the MMT unit activities in delivery of Primary Health care through basic consultations, nutrition supplements, screen common diseases, basic treatment and referral services to district level health care facilities; - Coach MMT members and monitor their activities followed by making recommendations for and supporting the promotion of MMT effectiveness and efficiency;  Work in close relationship with MMT clerical Assistants and Monitor, controlling and promoting the usage of the standardized program monitoring approach, keeping records on program activities, regular and quality data management etc."
1332,MSF Cabinet Secretary/ Translator,The Secretary/Translator is the key person in the day-to-day secretarial work and translating work in MSF Cabinets.,- Manage reception desk; - Draft letters; - File correspondence; - Enter and extract in Epi.Info and SPSS programs; - Manage stationery stocks; - Make translations.
1335,Local Consultant on International experience in Science,The incumbent will work under the overall supervision of UNDP Portfolio Manager and direct supervision of Team Leader for Science Component of Strengthening Policy Development Capacities of the MES.,"- Investigate science management system models in more than twenty countries, reveal their basic principles, analyze, summarize and compare relevant statistical data; - Analyze and compare international experience related to legislative field of scientific sector, scientific work and intellectual property assessment models, operational principles of efficient and competitive scientific structures, most successful mechanisms of state management and promotion of the sector, particularly structural, functional and institutional rules and structures that can be adopted; - Make recommendations on international models of state management as well as legislative and functional regulation of the sector that can be adjusted and localised with the aim of developing a Concept Paper and policy recommendations on science state management system reforms."
1336,Administrative Assistant,Under the direct supervision of the General Director the Administrative Assistant will be responsible for a variety of tasks essential to maintaining efficient office operation. This position requires ability to plan a complex range of duties in a constructive and autonomous manner.,"- Manage human resource issues including the personnel files; - Distribution and maintenance of office correspondence, register incoming and outgoing correspondence; - Record and prepare minutes of meetings; - Assist the general director."
1337,Research Analysts,Japonica Intersectoral seeks to hire 7 to 10 individuals for the positions of Research Analysts for its Yerevan Office. Research Analysts will be responsible for writing research reviews.,"- Receive opportunities to do quantitative modeling & analytical writing, and to make presentations; - Produce high quality value-added research reviews; - Provide research reviews in accordance with a process checklist to ensure consistency of format and quality of deliverable; - Meet the deadlines and the specified quality; - Develop research and analytical skills building sector-specific knowledge; - Coordinate content development and maintain report review procedure set by Research Manager; - Participate in peer review process according to process checklist."
1339,Air Tickets Seller,"We are looking for a responsible, dedicated person, with good skills of communication, ready to fulfil the position of Air Tickets Seller in an air-tickets sales agency.",Realize the sales of air-tickets.
1340,Store-Chain Manager/ Executive Director,"We are looking for an active and energetic person, with good skills of communication and strong sense of responsibility to fill the position of Store-Chain Manager/ Executive Director in a clothing and accessories store.",- Organize and manage everyday business of the store/shop; - Lead the stuff; - Travel abroad and make assessment reports for the company; - Manage the whole process of in-store sales; - Maintain the communication with the Chain of stores in foreign countries.
1343,Program Manager Assistant,Union of Information Technology Enterprises is seeking a Program Manager Assistant to help with the organization of an exhibition. The icumbent will help the Program Manager to keep in touch with IT community of Armenia via systematic contacts. Also assistant should carry out tasks concerning PR and marketing.,"- Follow up the correspondence concerning the exhibition; - Perform administrative tasks; - Find out new participants and maintain personal contacts with firms and companies who would like to participate in the exhibition; - Distribute exhibition promotional materials; - Create, manage and update data base of that firms; - Prepare and process documents (registration forms, contracts, reports, correspondence) for the exhibition participants; - Carry out routine work upon request; - Perform tasks concerning conference;  - Assist the Program Manager."
1345,Receptionist/ Secretary,"Under the direct supervision of the CARD Administrative Services Manager, the Receptionist will provide secretarial/clerical support and daytime dispatcher services.","- Answer telephone calls and refer them as appropriate; - Take phone messages and promptly deliver them; - Send and receive faxes, mail, and e-mail;  - Register and distribute all incoming/outgoing mail as appropriate;  - Maintain telephone/address directory;  - Provide the necessary administrative and secretarial support to CARD service team; - Draft and file correspondence, make photocopies, enter data, make translations, take minutes of meetings, etc.; - Keep accurate track of long distance telephone calls, monthly reconciliation of telephone bills; - Perform daytime vehicle dispatch duties; - Perform any other duties as may be assigned by the supervisor."
1346,Procurement Specialist,"Under the direct supervision of the CARD Administrative Services Manager, the Procurement Specialist will be mainly responsible for procurement of goods and services necessary for efficient operation of CARD.","- Procurement of office supplies and equipment, computer equipment and vehicle spare parts in accordance with CARD policies and procedures; - Procurement of phones, cell phones, radios and other communication equipment required for CARD operations; - Procurement of commodities required for program-related activities; - Contract for office/equipment repair and maintenance, from market research and bid solicitation to cost analysis, negotiation, contract preparation and management; - Contract for computer and communication equipment repair and maintenance; - Contract for CARD vehicle repair and maintenance work; - Procurement planning and maintenance of vendor/supplier database; - Other duties as may be assigned by the supervisor."
1347,"Computer, Network and Communication Specialist","Under the direct supervision of the CARD Administrative Services Manager, the Computer Network and Communication Specialist will be responsible for computer system administration, computer network management, user support and IT equipment maintenance to include telephone network.","- Network management including registration of new users, deleting of the outdated users, and keeping CARD users rights; - Maintain the architecture of the network in accordance with CARD objectives; - Provide network security through regular anti-virus prophylactics: prevention and protection from hacking, unintentional damage, electricity failure, etc.; - Computer network, IT equipment and phone system maintenance; - Supervision of IT service providers contracted by CARD and quality assurance; - Installation and maintenance of new computer hardware and software; - IT training and support for CARD staff, including assistance with IT service planning and application; - Internet access management and maintenance; - Update and maintain CARD web page; - Provision of monthly phone usage report; - Perform any other duties as may be assigned by the supervisor."
1348,Logistics and Warehouse Coordinator,"Under the direct supervision of the CARD Administrative Services Manager, the Logistics and Warehouse Coordinator will be responsible for warehouse management and office property control.","- Control office inventory, CARD warehouse and leased apartments; - Maintain CARD inventory management and classification system; - Prepare required inventory reports; - Conduct annual physical inventory and make arrangements for inventory disposal as necessary; - Receive and record CARD-procured supplies and equipment, process customs clearance as necessary and prepare the receiving and inspection reports; - Respond to staff requests for supplies and equipment, request items not available in the stock; - Prepare monthly replenishment requests; - Make arrangements for repair/renovation work to be performed at leased apartments; - Prepare welcome kits for incoming consultants; - Prepare monthly utility payments for leased apartments and monthly reports on recurring expenses; - Pick up monthly office utility bills; - Bring leased apartments to their initial (original) condition at the end of rental period or in case of termination; - Provide full range of logistical support by fulfilling necessary responsibilities related to accommodation, reservation/ticketing, visa and customs processing; - Provide airport expeditor services; - Perform any other duties as may be assigned by the supervisor."
1349,Sales Manager,"We are looking for a dedicated, responsible, active and enthusiastic personality for the position of Sales Manager.","- Develop new business; - Manage the accountancy when needed; - Create sales strategy and work with the board on account productivity, opportunities and strategic direction; - Identify and develop new markets; - Accurate data entry, report and develop account management system; - Achieve established revenue goals and report monthly; - Maintain existing business accounts; - Use problem-solving methodology for decision making and follow-up."
1350,Dean of Law Department,"American University of Armenia is seeking a candidate for the position of Dean of Law Department to provide academic leadership in all aspects of the Department, including strategic planning, curricular leadership, program growth and development, hiring and evaluation of faculty, fiscal management and outcome assessment, and fundraising.","Academic Leadership:  - Formulation and implementation of the academic program of the Department including: a) the development of curriculum and quality of teaching; b) development of research programs; c) development of projects.  Faculty Recruitment: - Recruitment of the faculty of the Law Department in conjunction with the Recruitment Coordinator, as well as, Vice President and President of the University; - Determine the teaching load of each faculty member and their specific responsibilities and compensation.  Administrative Leadership: - Coordination of all pertinent matters with the AUA offices in Oakland and Yerevan, and with the AUA Vice President; - Supervise the overall activities of the Law Department at AUA, and manage the budget of the Department, working with the AUA Accounting Office and AUAC office on all accounting matters; - Serve on committees, including the Admissions Committee as may be necessary for the overall program of the University. - Work with the Law Department faculty to provide them with the requisite guidance, academic support and coordination and to consult with them on their concerns. Evaluation:  - Evaluate the Law Department faculty at least once a year.   General Provisions: - In performing the responsibilities, consult with the President on all significant matters pertaining to the academic and administrative responsibilities."
1351,Administrative Officer,"The role of the Administrative Officer is to provide the effective administrative services for the Yerevan Office including administration, logistics, communications and liaison, filing and the management of the office supplies storeroom. It is the Administrative Officer's duty to ensure that all administrative functions comply with established SC policies and procedures and are within compliance with USAID regulations.","- Ensure that all aspects of the Field Office communication systems are reliable and adequate for the needs of the program. Ensure that all documents are sent, received, copied, translated and filed in a manner consistent with established SC policies and procedures. When necessary, make arrangements for translation services for the Office needs. Ensure that incoming emails are transferred to appropriate employees. Coordinate, setup and oversee routine maintenance and upkeep of all administration related files and archive systems in close cooperation with MIS Officer; - Ensure that telephone communications and the reception of guests in the office are conducted in a timely, courteous and professional manner. Identify the personal and business calls made from the office phones. Update the contact lists of the SC employees, SC sub-offices, international organizations, foreign embassies, travel agencies, hotels, government of RA, etc. Ensure that all the employees are provided with ID cards; - Manage the storeroom of office supplies. Make sure that the store doesnt run out of supplies. Place timely orders for the procurement of office supplies. Maintain the office supplies log; - Maintain the subscription of the newspapers and magazines and ensure that they are received on time, registered and circulated. Manage the Field Office Library. Periodically update the Library list and ensure that the users return the books on time; - Maintain the staff attendance log-book, keep appropriate records and report to the Finance Manager on staff attendance issues. Manage national personnel issues related to staff attendance such as time sheets and tracking of leave accrual and usage; - Provide logistical support to all SC staff including processing and facilitating residence visa for expatriate staff, consultants, guests, including arrangements for travel and accommodation. Provide support to national and international staff in the case of an emergency, like disaster-related evacuation, medical evacuation etc.; - Maintain all lease agreements for offices, expatriate residences and other facilities, initiate renewal of the lease agreements; - At the initiation of the program or other departments, organize recruitment of staff including advertisement and CV collecting; - Provide oversight over the work of the Cleaner and Cook."
1352,Accountant,The company seeks qualified Accountants to join its team in Yerevan.,"- Prepare reports (monthly, quarterly, annual) and submit to the Tax Inspectorate; - Work with banks to process financial transactions; - Check and authorize all income and pay-out papers; - Close all accounts; - Perform other related duties as assigned."
1354,Project Manager and Adviser on Internal Political Issues,"The successful applicant will be responsible for developing the British Embassy's assistance programmes in the areas of human rights, good governance, conflict prevention and peace-building and environmental protection.","The jobholder will administer and take part in the selection of Chevening Scholarships, and develop public diplomacy initiatives."
1356,Driver,The Driver will work under the supervision of the Senior Driver to ensure the smooth running of the Embassy Transport Fleet.,"- Drive members of the Embassy staff, - Routine vehicle maintenance checks; - Other tasks as required by the Embassy."
1359,Senior Developer,"LinkGard Systems, LLC is seeking a highly experienced Senior Developer that can design and develop Microsoft applications. We need ethical, energetic, and highly motivated individuals.",- Design and analysis of software applications; - Maintenance of existing software applications; - Write documentation in English.
1362,"Project Assistant, GS-4","The Project Assistant will work under direct supervision of the Project Officer, and in close cooperation with the project staff.","- Assist the Project Officer in personnel, financial and administrative management; - Support the Project Officer in conducting supervision and monitoring of the project activities; - Advise and assist other staff in the area of office and financial management, administrative issues; - Manage day-to-day administrative and financial matters; - Prepare the required financial and administrative reports; - Prepare travel authorization forms and assemble information pertinent to purpose of travel; - Maintain office, and provide for security, transport, and similar services; - Support the Project Officer and UNFPA in procurement of the inputs for the project activities; - Requisition office supplies and equipment and arrange for control and distribution; - Maintenance of appropriate inventory records; - Support the Project Officer in supervision of the driver and other administrative staff; - Maintenance of the archive for the project documentation; - Other duties as required within the area of the assignment."
1364,"Project Driver, GS-2",The Project Driver will work under the supervision of the Project Director and the Project Officer.,"- Drive office vehicle for the transport of authorized personnel and delivery and collection of mail, documents, other items; - Day-to-day maintenance of the assigned vehicle, perform minor repairs and arrange for other repairs and ensure is kept clean. - Ensure that the steps required by UN/UNFPA rules and regulations are taken in case of involvement in accident; - Perform other duties as required."
